<?xml version="1.0" encoding="UTF-8"?>
<xs:schema xmlns:xs="http://www.w3.org/2001/XMLSchema" xmlns="https://moriwoodworkers.vercel.app/" targetNamespace="https://moriwoodworkers.vercel.app/" elementFormDefault="qualified">
    <xs:element name="woodworking">
        <xs:complexType>
            <xs:sequence>
                <xs:element name="wood" maxOccurs="unbounded">
                    <xs:complexType>
                        <xs:sequence>
                            <xs:element name="type" type="xs:string" />
                            <xs:element name="hardness">
                                <xs:simpleType>
                                    <xs:restriction base="xs:decimal">
                                        <xs:minInclusive value="0.0" />
                                        <xs:maxInclusive value="10.0" />
                                    </xs:restriction>
                                </xs:simpleType>
                            </xs:element>
                            <xs:element name="price">
                                <xs:simpleType>
                                    <xs:restriction base="xs:decimal">
                                        <xs:minExclusive value="0.0" />
                                    </xs:restriction>
                                </xs:simpleType>
                            </xs:element>
                            <xs:element name="origin" type="xs:string" />
                        </xs:sequence>
                    </xs:complexType>
                </xs:element>
            </xs:sequence>
        </xs:complexType>
    </xs:element>
</xs:schema>
