<?xml version="1.0" encoding="UTF-8"?>
<?xml-stylesheet type="text/xsl" href="woodworking.xsl"?>
<woodworking xmlns="https://moriwoodworkers.vercel.app/" xmlns:xsi="http://www.w3.org/2001/XMLSchema-instance" xsi:schemaLocation="https://moriwoodworkers.vercel.app/ woodworking.xsd">
    <wood>
        <type>Oak</type>
        <hardness>7.5</hardness>
        <price>120.50</price>
        <origin>USA</origin>
    </wood>
    <wood>
        <type>Pine</type>
        <hardness>4.2</hardness>
        <price>80.75</price>
        <origin>Canada</origin>
    </wood>
    <wood>
        <type>Teak</type>
        <hardness>9.1</hardness>
        <price>200.00</price>
        <origin>India</origin>
    </wood>
    <wood>
        <type>Mahogany</type>
        <hardness>8.3</hardness>
        <price>150.00</price>
        <origin>Honduras</origin>
    </wood>
    <wood>
        <type>Maple</type>
        <hardness>7.0</hardness>
        <price>110.00</price>
        <origin>USA</origin>
    </wood>
    <wood>
        <type>Cedar</type>
        <hardness>5.4</hardness>
        <price>90.00</price>
        <origin>Spain</origin>
    </wood>
    <wood>
        <type>Walnut</type>
        <hardness>9.0</hardness>
        <price>180.00</price>
        <origin>France</origin>
    </wood>
    <wood>
        <type>Cherry</type>
        <hardness>8.0</hardness>
        <price>160.00</price>
        <origin>USA</origin>
    </wood>
    <wood>
        <type>Birch</type>
        <hardness>6.5</hardness>
        <price>100.00</price>
        <origin>Finland</origin>
    </wood>
</woodworking>
